war	allegedly	so-called 	nationalists 	nazis 	fascists	the goals of the special operation	azov	bandera	banderites	free 	hysteria	unfriendly	great power	west	fascism	foreign agent 	brotherly nations	people of donbass 	russophobia 	russophobic	soros	great victory 	anglo-saxons	great patriotic war	external control 	spiritual scrapes 	denacification 	deukrainianization	demilitarization 	kiev regime 	special operation 	on ukraine	in ukraine	in donbass 	junta	kiev regime 	coup d'etat	reunification of crimea and sevastopol with russia 	return of crimea	civil war	ukraine border with the crimea	export of ukraine with crimea 	dnr	lnr	people's republics of donbass	self-proclaimed republics	borders of lnr/dnr	russian volunteers	self-defense	militia 	retirees	vacationers	novorossiya	southeast ukraine	southeast ukraine	baltic countries	belarus	belorussia	old russian	post-soviet space	near abroad 	color revolution 	ukrainian crisis	internal conflict in ukraine 	ukrainian-russian conflict 	armed formations of ukraine 	punishers 	kiev army 	republic of crimea	aggression of ukraine against donbass	genocide of the inhabitants of donbass 	8 years	russian spring	declaration of will of the people 	crimean referendum 	the polite men 	crimean blockade	crimean bridge 	special status of donbass 	people of donbass 	people's militia	forced migrants	blockage of supplies 	national battalion 	ukrainian nationalist paramilitaries 	demarcation line 	buffer zone 	russian world	orthodox world	prednestrovian moldavian republic 	republic of abkhazia 	south ossetia 	russcists	rashism	attack	invasion	russia's war against ukraine	deceased	fake	rape	looting	victims	arms deliveries	children	refugees	europe	war crimes	genocide 	pumping	pump	negotiations	sanctions 	embargo	kremlin 	kremlin regime	text
0	0	0	0	0	0	0	0	0	0	0	0	0	0	0	0	0	0	0	0	0	0	0	0	0	0	0	0	0	0	0	0	0	0	0	0	0	0	0	0	0	0	0	0	0	0	0	0	0	0	0	0	0	0	0	0	0	0	0	0	0	0	0	0	0	0	0	0	0	0	0	0	0	0	0	0	0	0	0	0	0	0	0	0	0	0	0	0	0	0	0	0	0	0	0	0	0	0	0	0	0	0	0	0	0	0	0	0	0	0	0	0	0	0	0	0	Image Prime Minister Imran Khan of Pakistan, center left, came to power on a nationalist platform. Credit... Aamir Qureshi/Agence France-Presse — Getty Images  The Supreme Court on Monday heard a challenge to the political moves by Prime Minister Imran Khan of Pakistan that kept him in power, including his call to dissolve Parliament, before adjourning for the day.  Mr. Khan and his allies on Sunday blocked a no-confidence vote that he appeared set to lose, an outcome that would have ousted him as prime minister. But the maneuver plunged Pakistan into a constitutional crisis and threw the nation’s leadership into question.  Many legal observers expected the Supreme Court to overrule Mr. Khan. But it could also agree to allow elections for a new assembly to go ahead, which would give Mr. Khan a window to rally support for his leadership. A timeline for the court’s ruling was not immediately clear, and analysts worried that a lengthy process could fuel uncertainty about the country’s political future.  Mr. Khan, 69, is a former cricket star who came to power on a nationalist platform and pledges to tackle corruption. His popularity has taken a hit in recent months as inflation has surged.  His relationship with Pakistan’s powerful military, which has ruled the country intermittently since its independence in 1947, soured after he refused to back the appointment of a new chief of the country’s intelligence agency last year.  Lawmakers began convening last week, and allies to his Pakistan Tehreek-e-Insaf party announced that they were dropping support. The opposition then mustered the simple majority of votes they needed to remove Mr. Khan from office.  But the vote Sunday was blocked by Mr. Khan’s allies in the National Assembly, who said that he planned to dissolve the body, a move he later confirmed in a televised speech. Mr. Khan repeated his assertion that the opposition was acting in concert with the United States government to oust him, accusing an American diplomat of issuing a threat to Pakistan’s ambassador to the United States. American officials have denied any involvement in the campaign to remove Mr. Khan.  The crisis revives the prospect of political instability in Pakistan, a nuclear power where no prime minister has served a full five-year term.
6	0	0	0	0	0	0	0	0	0	0	0	0	0	0	0	0	0	0	0	0	0	0	0	0	0	0	0	0	0	0	0	0	0	0	0	0	0	0	0	0	0	0	0	0	0	0	0	0	0	0	0	0	0	0	0	0	0	0	0	0	0	0	0	0	0	0	0	0	0	0	0	0	0	0	0	0	0	0	0	0	0	0	0	0	0	0	0	0	0	0	0	0	0	0	0	0	0	0	0	1	0	0	0	0	0	0	0	0	0	0	0	0	0	0	0	Image A health care worker administering Covid vaccines to students in Chitungwiza, Zimbabwe, last week. Credit... Aaron Ufumeli/EPA, via Shutterstock  Democratic and Republican senators are considering cutting as much as $5 billion in funding for the global vaccination effort from an emerging aid package — assistance that is central to President Biden’s strategy of reducing vaccine inequality and limiting the impact of the next coronavirus variant.  On Monday, the Senate will continue to trying to resolve a battle over a broader emergency coronavirus response package by slimming it to $10 billion from $15.6 billion. It was not clear whether the narrower bill would have the votes to move forward in either chamber of Congress.  While access to vaccines has gradually expanded around the world, administering the shots remains a challenge for a multitude of reasons. In many low-income countries, only about 15 percent of the population has received at least one vaccine dose, compared with about 80 percent of the population in many middle- and high-income countries, according to the Our World in Data project at the University of Oxford.  Hence the need for urgent additional financial assistance, said Gayle Smith, a former State Department coordinator for global Covid response and health security. Cutting the aid, she said, could “signal that the United States kind of thinks the pandemic has been managed.” And while $5 billion is a significant sum, she said, it is far less than the “double-digit trillions this pandemic has cost the world.”  The issue is not only saving lives abroad. Uncontrolled outbreaks allow more dangerous virus variants to emerge, as occurred with Omicron, prolonging the pandemic and threatening yet more damage to the global economy. “Our goal has to be — not just the U.S. but every country in the world — has to be shutting this down as quickly as possible so that we, No. 1, minimize the risk of new variants,” Ms. Smith said.  The United States has led the way in the world’s pandemic response, Ms. Smith said, allotting the effort $11 billion as part of the American Rescue Plan passed last year. The country has also donated hundreds of millions of vaccine doses through the Covax global initiative and pledged many more.  The $4 billion the United States dedicated to Covax for the last fiscal year made up 36 percent of the initiative’s budget, according to an analysis by the Kaiser Family Foundation.  When asked at a White House press briefing on Thursday whether Mr. Biden would sign or veto a bill that did not include significant international aid, Kate Bedingfield, the communications director, said the president had been clear on the importance of funding efforts globally.  “Right now, countries in fact are declining our doses because they don’t have the infrastructure in place to take our lifesaving vaccines,” Ms. Bedingfield said. “Funding will obviously help solve this issue.”  The aid would also go toward other supplies, including protective gear and Covid treatments. Republicans have said they will support the aid, but have demanded that it be paid for by repurposing money already approved by Congress earlier in the pandemic.  Public health experts worry that wealthier nations are leaving other countries behind as they turn to third and fourth vaccine doses. The World Health Organization has been pushing for wealthier nations to share access to vaccines and therapeutics with the world’s more vulnerable populations.  “We can end the acute phase of #COVID19 this year but only if we work together to close inequities in access to vaccines and other lifesaving tools,” Dr. Tedros Adhanom Ghebreyesus, the organization’s director general, said in a video he posted to Twitter on Tuesday.  Devi Sridhar, a professor and head of the global public health program at the University of Edinburgh, described the cut to the proposed package as a “major step backward.”  “I am worried that as we declare the end of the pandemic in Britain and the United States, we forget that it’s still causing a lot of devastation in other places, even if we’re not reading about it in the headlines,” Professor Sridhar said.  The uncertainty over Covid funding comes as the vaccination campaign has stalled in the United States, where total cases have now surpassed 80 million, according to a New York Times database. Daily inoculation rates have fallen to their lowest levels since vaccines became widely available to the public in early 2021.  About 32,730 people received their first shot this week, according to the Centers for Disease Control and Prevention. Booster shots are also waning, with only about 52,000 people getting their booster this week, compared with about a million people per week in early December, shortly after Omicron was detected in the United States.
22	0	0	0	0	0	0	0	0	0	0	0	0	0	0	0	0	0	0	0	0	0	0	0	0	0	0	0	0	0	0	0	2	6	0	0	0	0	0	0	0	0	0	0	0	0	0	0	0	0	0	0	0	0	0	0	0	0	0	0	0	0	0	0	0	0	0	0	0	0	0	0	0	0	0	0	0	0	0	0	0	0	0	0	0	0	0	0	0	0	0	0	0	0	0	0	6	0	0	0	0	0	0	0	0	0	27	0	0	0	0	0	0	0	3	0	BUDAPEST — Overshadowed by the war in Ukraine, elections on Sunday in Hungary and Serbia appear to have extended the tenures of Europe’s two most Kremlin-friendly leaders, both populist strongmen fortified by their overwhelming control of the media and cheap energy from Russia.  With more than 60 percent of the votes counted in Hungary, preliminary results indicated that Viktor Orban, Hungary’s prime minister since 2010, and already Europe’s longest serving leader, had won a fourth consecutive term despite accusations by the opposition that he has enabled Russia’s military onslaught by cozying up for years to President Vladimir V. Putin of Russia.  “We won a victory so big that you can perhaps see it from the moon, and certainly from Brussels,” Mr. Orban told a jubilant crowd of supporters late Sunday, taking a dig at the European Union, which he has long accused of pushing L.G.B.T.Q. and migrant rights in defiance of the democratic will of Hungarian voters.  The preliminary results dashed the hopes of Mr. Orban’s political foes that an unusually united opposition camp could break his ruling Fidesz party’s increasingly authoritarian grip on the Central European nation next to Ukraine.  Ukraine’s president, Volodymyr Zelensky, speaking early Sunday in his capital, Kyiv, described Mr. Orban as “virtually the only one in Europe to openly support Mr. Putin.”  Asked about Mr. Zelensky’s assessment after casting his vote in Budapest on Sunday morning, Mr. Orban said curtly: “Mr. Zelensky is not voting today. Thank you. Are there any other questions?”  Image Voting Sunday in Hungary’s elections at a school in Budapest, the capital. Credit... Nanna Heitmann for The New York Times  President Aleksandar Vucic of Serbia, also Moscow-friendly, has governed Serbia since 2012, and was expected to win re-election after rallying his nationalist and pro-Russian base by refusing to join the European Union in imposing sanctions on Russia. Serbia hopes to become a member of the European bloc, but its application has stalled.  An unusually high turnout in Serbia of nearly 60 percent forced officials to keep polling stations open late into the evening in some areas. Amid complaints of foul play by the opposition, the central election commission in Belgrade, the capital, said it would not issue results until Monday morning.  But exit polls indicated that Mr. Vucic would win a new term as president and that his Serbian Progressive Party would retain its hold on Parliament, albeit with a reduced majority. The opposition said it had won control of the municipal government in Belgrade.  Hungary and Serbia have very different histories. Mr. Orban governs a country that, until he came to power, viewed Russia with great distrust as a result of its past suffering at Russia’s hands, most notably when Moscow sent troops to brutally crush an anti-communist uprising in 1956. Mr. Vucic’s nation, however — Slavic and Orthodox Christian, like Russia — has long looked to Moscow as its ally and protector.  But under the two strongmen leaders, both countries have over the past decade drastically reduced the space for critical media voices, turning television stations with national reach into propaganda bullhorns and moving toward authoritarian rule. Each has cultivated close ties with Mr. Putin, who endorsed the Hungarian leader’s election campaign when he visited Moscow in February shortly before the invasion of Ukraine.  Image Mr. Orban’s supporters at the rally on Friday. Credit... Nanna Heitmann for The New York Times  Serbia declined to impose sanctions on Russia while Hungary, a member of the European Union since 2004, agreed to an initial round of European sanctions but has strongly resisted extending them to include restrictions on energy imports from Russia.  In contrast to leaders in neighboring Poland, previously a close ally of Mr. Orban thanks to their shared hostility to liberal values, the Hungarian leader has also refused to let weapons destined for Ukraine pass though his country.  Before Hungary’s election, Mr. Orban hit back to counter opposition charges that his policy on Ukraine had betrayed not only foreign allies but also Hungary’s own painful memories of aggression by Russia. Mr. Orban mobilized the news media, most of which is controlled by the state and by friendly tycoons, to cast his opponents as warmongers bent on sending Hungarian troops to fight against Russia. The election offered a “choice between war and peace,” pro-government media warned.  The campaign seems to have worked, even among some older voters who remember the suffering caused by Moscow’s troops in 1956. “Why should Hungarian boys fight for Ukraine?” asked Janos Dioszegi, who was 13 at the time of the Hungarian uprising and whose father was imprisoned for 14 years by Soviet-backed authorities for his part in the anti-Moscow uprising. He said “of course” he chose Mr. Orban’s Fidesz party when he voted in Nagykovacsi, a small town near Budapest.  Echoing a line frequently aired in Fidesz-controlled media outlets, Mr. Dioszegi said there was no need to help Ukraine defend itself because it had provoked the war by becoming “a military base for America.”  Until Mr. Putin sent troops into Ukraine on Feb. 24, the centerpiece of Mr. Orban’s election campaign was an inflammatory referendum, timed for the day of the parliamentary election, on whether young children should be taught in school about gender transition surgery treatment, and exposed without restriction to sexually explicit material.  The war next door in Ukraine, however, derailed Mr. Orban’s effort to get voters to focus on transgender individuals and gays, forcing a reboot focused on painting his opponents as eager to take Hungary to war.  Image Demonstrations in Budapest on Saturday, where people gathered in solidarity with Ukraine. Credit... Nanna Heitmann for The New York Times  When hundreds of pro-Ukrainian Hungarians and refugees from Ukraine gathered on Saturday in central Budapest to denounce the government’s fence-sitting on the war, the main state-controlled television station, M1, described the event as a “pro-war rally.” Anna Olishevska, a 24-year-old Ukrainian from Kyiv who took part, praised the ordinary Hungarians who she said had helped her after she fled across the border. More than 500,000 Ukrainians have crossed into Hungary over the past month, far fewer than the more than two million who have entered Poland but still a large number for a country where venomous hostility to foreign migrants had long been the cornerstone of Mr. Orban’s often xenophobic political platform.  While delighted by her reception in Hungary, Ms. Olishevska said the government had been so tentative in condemning Russia’s invasion and resistant to helping Ukraine defend itself, that she worries about staying in Hungary if Mr. Orban won another term.  “I can’t stay in a country where the government supports Russia,” she said, waving a hand-painted sign telling Mr. Putin where to stick his rockets.  Some prominent supporters of Mr. Orban’s party have even blamed Ukraine for the bloodshed in 1956, with Maria Schmidt, a historian and museum director, claiming falsely on Saturday that Nikita S. Khrushchev, the Soviet leader who ordered troops into Hungary that year, was Ukrainian. He was Russian. Ms. Schmidt misrepresented the Soviet leader’s origins in response to a tweet by the British comedian John Cleese, who urged Hungarian voters to consider whether it was Russia or Ukraine that invaded Hungary in 1956.  Image Election Day in Budapest, the capital. Government control of the news media has fortified Mr. Orban’s position. Credit... Nanna Heitmann for The New York Times  The blizzard of distortions and falsehoods in Hungarian news media outlets controlled by Fidesz has left opposition supporters in despair.  “They just repeat lies over and over, day after day,” Judit Barna, 81, a doctor, said outside a central Budapest polling station, where she had just voted for a united opposition ticket headed by Peter Marki Zay, a conservative small town mayor.  Referring to Mr. Orban’s early political career as an anti-Moscow firebrand who in 1989 demanded that Soviet troops leave, she asked: “How is it possible after 40 years of Soviet occupation and 30 years of democracy that the same guy who once shouted, ‘Russians, go home’ can now say that Russia is fighting a just war in Ukraine?”  Thanks to Fidesz’s stranglehold on the media, she added: “Half of Hungary’s population eats up all these lies. This is Hungary’s shame.”
0	0	0	0	0	0	0	0	0	0	0	0	0	0	2	0	0	0	0	0	0	0	0	0	0	0	0	0	0	0	0	0	0	0	0	0	0	0	0	0	0	0	0	0	0	0	0	0	0	0	0	0	0	0	0	0	0	0	0	0	0	0	0	0	0	0	0	0	0	0	0	0	0	0	0	0	0	0	0	0	0	0	0	0	0	0	0	0	0	0	0	0	0	0	0	0	3	0	1	0	0	0	0	0	0	0	0	0	0	0	0	0	0	0	0	0	A unit of ethnic Chechen fighters, who were bearded and wore black uniforms, had searched door to door, she said. If an occupant opened the door, she said, the fighters generally just searched for weapons and left. If nobody opened the door, she said, they would kick it in to search.  Others fared far worse. Vitaly Sinadin, a 45-year-old sculptor who was hobbling down a street on Sunday afternoon, said he had been tied to a metal pole for two days in a cinderblock house used by Russian forces as a base.  “They beat me, asking, ‘Where are the Ukrainian soldiers?’ and ‘Who in town is in the Territorial Defense Force?’” — a reference to the volunteer units that sprang up in the first days of the Russian invasion. A sprawling red-and-black bruise covering his thighs and back was consistent with his account of extensive beatings.  On Sunday afternoon, on a road leading west out of Bucha, a man lay dead on his back, his green bicycle toppled beside him. Shot through the face, he bore a large hole in the back of his skull.  Farther along that road — in a clearing in a pine forest on the edge of the village of Dmytrivka — the police had earlier in the day pulled the body of a Russian soldier, his face and uniform burned, from the turret of a blown-up tank. His documents showed he was 22, and from Buratyia in eastern Siberia.
4	0	0	0	0	0	0	0	0	0	0	0	0	0	6	0	0	0	0	0	0	0	0	0	0	0	0	0	0	0	0	0	0	2	0	0	0	0	0	0	0	0	0	0	0	0	0	0	0	0	0	0	0	0	0	0	0	0	0	0	0	0	3	0	0	0	0	0	0	0	0	0	0	0	0	0	0	0	0	0	0	0	0	0	0	0	0	0	0	0	0	0	0	0	0	0	3	0	0	0	0	0	0	0	0	0	0	0	0	0	0	0	0	0	0	0	It’s unclear whether allegations of atrocities by Russia soldiers, with civilians found shot in the head or with their hands tied behind their back before being killed, will effect China’s support of the Russian invasion.  But China has so far refused to condemn Mr. Putin for the war, which has killed thousands of civilians. Despite pressure from other world leaders to use its influence over Moscow to help end the crisis, Beijing has done little besides call for peace. And on Thursday Wang Yi, the Chinese foreign minister, expressed his country’s commitment to strong ties with Moscow during talks with his Russian counterpart, Sergey Lavrov, in China.  The Biden administration has cast the war as a contest between democracy and authoritarianism. Chinese officials are mounting a counternarrative that American-led domineering is the source of conflict in Ukraine and elsewhere. They regard China and Russia as both menaced by “color revolution,” the party’s phrase for insurrections backed by Western governments. President Biden’s recent comments calling for Mr. Putin’s ousting are likely to reinforce Beijing’s view.  “They actually believe their own narrative about color revolutions and tend to see this whole situation as a U.S.-led color revolution to overthrow Putin,” said Christopher K. Johnson, the president of the China Strategies Group and a former Central Intelligence Agency analyst of Chinese politics.  “Both domestically and internationally, Xi has been peddling this dark narrative since he took power,” Mr. Johnson said in an interview. “It allows him to justify his accumulation of power and the changes he’s made by creating this sense of struggle and danger.”  The documentary depicts the collapse of the Soviet Union as a lesson to Chinese officials not to be seduced by Western liberalism. China, the documentary says, must never follow the course taken by Mikhail S. Gorbachev, the Soviet Union’s last leader who had started glasnost, or openness, and engagement with the West.
10	0	0	0	3	0	0	0	0	0	0	0	0	0	2	0	0	0	0	0	0	0	0	0	0	0	0	0	0	0	0	0	0	0	0	0	0	0	0	0	0	0	0	0	0	0	0	0	0	0	0	0	0	0	0	0	0	0	0	0	0	0	0	0	0	0	0	0	0	0	0	0	0	0	0	0	0	0	0	0	0	0	0	0	0	0	0	0	0	0	0	0	0	0	0	0	6	0	0	0	0	0	0	0	0	0	0	0	0	0	0	0	0	0	0	0	The claims by Ukraine do not compare to the falsehoods being spread by Russia, which laid the groundwork for a “false flag” operation in the lead-up to the invasion, which the Biden administration sought to derail. As the invasion neared, Russia falsely claimed that it was responding to Ukrainian aggression and liberating citizens from fascists and neo-Nazis. And since the assault began, Russia made baseless claims that Ukrainians had indiscriminately bombed hospitals and killed civilians.  Instead, Ukraine’s online propaganda is largely focused on its heroes and martyrs, characters who help dramatize tales of Ukrainian fortitude and Russian aggression.  But the Ukrainian claims on social media have also raised thorny questions about how false and unproven content should be handled during war — when lives are at stake and a Western ally is fighting for its survival against a powerful invading force.  “Ukraine is involved in pretty classic propaganda,” said Laura Edelson, a computer scientist studying misinformation at New York University. “They are telling stories that support their narrative. Sometimes false information is making its way in there, too, and more of it is getting through because of the overall environment.”  Anecdotes detailing Ukrainian bravery or Russian brutality are crucial to the country’s war plan, according to experts, and they are part of established war doctrine that values winning not just individual skirmishes but also the hearts and minds of citizens and international observers.  That is especially important during this conflict, as Ukrainians try to keep morale high among the fighters and marshal global support for their cause.  “If Ukraine had no messages of the righteousness of its cause, the popularity of its cause, the valor of its heroes, the suffering of its populace, then it would lose,” said Peter W. Singer, a strategist and senior fellow at New America, a think tank in Washington. “Not just the information war, but it would lose the overall war.”
